belongs_to_collection;genres;id;imdb_id;original_title;overview;poster_path;release_date;runtime;tagline;title;video;vote_average
;[{'id': 14, 'name': 'Fantasy'}, {'id': 18, 'name': 'Drama'}];422;tt0056801;8½;With 8 ½ Frederico Fellini leaves a self-portrait where dreams and reality are a mix. With help from a most excellent cast and unique scenery this self reflecting film is one of his master works.;/5pQlc8dp5dXzWg1yM70DZrsDpOl.jpg;14/02/1963;138.0;A picture that goes beyond what men think about - because no man ever thought about it in quite this way!;8½;False;7.9
;[{'id': 18, 'name': 'Drama'}, {'id': 10752, 'name': 'War'}];423;tt0253474;The Pianist;The Pianist is a film adapted from the biography of Wladyslaw Szpilman. A Jewish-Polish pianist who during the second world war lived and hid miraculously in Warsaw after having gone through a terrible tragedy. A film from Roman Polanski.;/iunmxWkOi7Vk17Ob3G2HwwjgHsr.jpg;24/09/2002;150.0;Music was his passion. Survival was his masterpiece.;The Pianist;False;8.1
;[{'id': 18, 'name': 'Drama'}, {'id': 36, 'name': 'History'}, {'id': 10752, 'name': 'War'}];424;tt0108052;Schindler's List;The true story of how businessman Oskar Schindler saved over a thousand Jewish lives from the Nazis while they worked as slaves in his factory during World War II.;/yPisjyLweCl1tbgwgtzBCNCBle.jpg;29/11/1993;195.0;Whoever saves one life, saves the world entire.;Schindler's List;False;8.3
{'id': 8354, 'name': 'Ice Age Collection', 'poster_path': '/stQoHvo0q6ZcEkji2Z1wlAxKnDq.jpg', 'backdrop_path': '/2Mb92Ssoe1eUecvrCe2pEvgAlmv.jpg'};[{'id': 16, 'name': 'Animation'}, {'id': 35, 'name': 'Comedy'}, {'id': 10751, 'name': 'Family'}, {'id': 12, 'name': 'Adventure'}];425;tt0268380;Ice Age;With the impending ice age almost upon them, a mismatched trio of prehistoric critters – Manny the woolly mammoth, Diego the saber-toothed tiger and Sid the giant sloth – find an orphaned infant and decide to return it to its human parents. Along the way, the unlikely allies become friends but, when enemies attack, their quest takes on far nobler aims.;/zpaQwR0YViPd83bx1e559QyZ35i.jpg;10/03/2002;81.0;They came. They thawed. They conquered.;Ice Age;False;7.1
;[{'id': 9648, 'name': 'Mystery'}, {'id': 10749, 'name': 'Romance'}, {'id': 53, 'name': 'Thriller'}];426;tt0052357;Vertigo;A retired San Francisco detective suffering from acrophobia investigates the strange activities of an old friend's wife, all the while becoming dangerously obsessed with her.;/obhM86qyv8RsE69XSMTtT9FdE0b.jpg;09/05/1958;128.0;Alfred Hitchcock engulfs you in a whirlpool of terror and tension!;Vertigo;False;8.0
;[{'id': 35, 'name': 'Comedy'}];427;tt0050706;Mon oncle;With many idea rich comic situations French director Jacques Tati uses his poetic ways and knowledge of the discrepancy between heart and technique to tell a gentle business satiric tale that won him the Oscar for best foreign film in 1959.;/wH6RyPiXFy8INLbViVkchLVOmBc.jpg;10/05/1958;110.0;Mr. Hulot Ventures Into Suburbia...And Disrupts...Disassembles...And Demolishes With His Very Subtle Satire;Mon oncle;False;7.3
;[{'id': 18, 'name': 'Drama'}, {'id': 10749, 'name': 'Romance'}];428;tt0806679;Sommer '04;Sommer ’04 is a character study of a family on vacation. German director Stefan Krohmer examines the emotional abyss and problems behind the seemingly nice facade of an intact family as they experience guilt, love and jealousy.;/isEfW9iwhyfmL7gXAVvyymSNl9Z.jpg;11/10/2006;97.0;;Summer '04;False;5.5
{'id': 48317, 'name': 'The Man With No Name Collection', 'poster_path': '/lzUZptOL6iQqulMvhB2jfT5GepD.jpg', 'backdrop_path': '/uAkE1MAvFUiYjOllgDRndispKu3.jpg'};[{'id': 37, 'name': 'Western'}];429;tt0060196;Il buono, il brutto, il cattivo;While the Civil War rages between the Union and the Confederacy, three men – a quiet loner, a ruthless hit man and a Mexican bandit – comb the American Southwest in search of a strongbox containing $200,000 in stolen gold.;/wfPHdfofBD5PN96dV96a51B3Ja2.jpg;23/12/1966;161.0;For three men the Civil War wasn't hell. It was practice.;The Good, the Bad and the Ugly;False;8.1
;[{'id': 35, 'name': 'Comedy'}, {'id': 10751, 'name': 'Family'}];430;tt0055256;One, Two, Three;A Coca-Cola executive in West Berlin tries to keep the boss's daughter from marrying a Communist.;/2BiQKt0e3PwmXNFeKYWfhLQ6pcd.jpg;15/12/1961;115.0;Billy Wilder's Explosive New Comedy;One, Two, Three;False;7.6
{'id': 432, 'name': 'Cube Collection', 'poster_path': '/pRshONhwgQYb2IYcxhEIMDFc62d.jpg', 'backdrop_path': '/4SdZhO4M5vJ48dqp7r8PieZ37RJ.jpg'};[{'id': 53, 'name': 'Thriller'}, {'id': 878, 'name': 'Science Fiction'}, {'id': 9648, 'name': 'Mystery'}];431;tt0123755;Cube;Seven strangers are taken out of their daily lives and placed mysteriously in a deadly cube where they all agree they must find their way out.;/u50r6chJGO2iqxVAvtQ07obiCkB.jpg;09/09/1997;90.0;Don't look for a reason... Look for a way out.;Cube;False;6.9
;[{'id': 35, 'name': 'Comedy'}, {'id': 10751, 'name': 'Family'}, {'id': 14, 'name': 'Fantasy'}];433;tt0058331;Mary Poppins;The movie combines a diverting story, songs, color and sequences of live action blended with the movements of animated figures. Mary Poppins is a kind of Super-nanny who flies in with her umbrella in response to the request of the Banks children and proceeds to put things right with the aid of her rather extraordinary magical powers before flying off again.;/oPXf92g2gjlPqduj6vRH9yvh0Yb.jpg;27/08/1964;139.0;It's supercalifragilisticexpialidocious!;Mary Poppins;False;7.4
;[{'id': 18, 'name': 'Drama'}, {'id': 53, 'name': 'Thriller'}];434;tt0475317;Knallhart;From the youth directed novel of the same name by Greogor Tressnow comes a film by Detlev Buck that is a realistic portrait of life in the section of Berlin called Neukölln. It’s about power and weakness, delinquents and victims, and the difficulties a 15-year-old faces in a poor and criminal environment.;/24GUshsd6GtcSY4Jo0Nh4ilkaXV.jpg;09/03/2006;99.0;;Tough Enough;False;7.2
;[{'id': 28, 'name': 'Action'}, {'id': 12, 'name': 'Adventure'}, {'id': 878, 'name': 'Science Fiction'}, {'id': 53, 'name': 'Thriller'}];435;tt0319262;The Day After Tomorrow;After years of increases in the greenhouse effect,  havoc is wreaked globally in the form of catastrophic hurricanes, tornadoes, tidal waves, floods and the beginning of a new Ice Age. Paleoclimatologist, Jack Hall tries to warn the world while also shepherding to safety his son, trapped in New York after the city is overwhelmed by the start of the new big freeze.;/pRmpaFjtegy8PnUvSBDyT9dm7c.jpg;26/05/2004;124.0;Where will you be?;The Day After Tomorrow;False;6.2
;[{'id': 18, 'name': 'Drama'}, {'id': 53, 'name': 'Thriller'}, {'id': 80, 'name': 'Crime'}];436;tt0390221;María, llena eres de gracia;A pregnant Colombian teenager becomes a drug mule to make some desperately needed money for her family.;/s9xK1tr8e6nFv8mxNpqZcOHEOnh.jpg;18/01/2004;101.0;Based on 10,000 true stories.;Maria Full of Grace;False;6.9
{'id': 432, 'name': 'Cube Collection', 'poster_path': '/pRshONhwgQYb2IYcxhEIMDFc62d.jpg', 'backdrop_path': '/4SdZhO4M5vJ48dqp7r8PieZ37RJ.jpg'};[{'id': 53, 'name': 'Thriller'}, {'id': 878, 'name': 'Science Fiction'}, {'id': 9648, 'name': 'Mystery'}];437;tt0285492;Cube 2: Hypercube;The sequel to the low budget first film ‘Cube.’ This time the prisoners find them selves in a more advanced cube environment that they must escape from before they are killed. A science fiction film where space and time have more than one path.;/6tPa2kvzsvOQTXK1JNO2JN9quBV.jpg;15/04/2002;94.0;There is more to fear than you can see.;Cube²: Hypercube;False;5.4
{'id': 432, 'name': 'Cube Collection', 'poster_path': '/pRshONhwgQYb2IYcxhEIMDFc62d.jpg', 'backdrop_path': '/4SdZhO4M5vJ48dqp7r8PieZ37RJ.jpg'};[{'id': 9648, 'name': 'Mystery'}, {'id': 878, 'name': 'Science Fiction'}, {'id': 53, 'name': 'Thriller'}];438;tt0377713;Cube Zero;Cube Zero is the third film in the trilogy yet this time instead of a film about people trapped in a deadly cube trying to get out we see it from the eyes of someone who is controlling the cube and the torture of the victims inside. When the nerd can’t stand to see a woman suffer he himself enters the cube to try and save her.;/m6Vn1rysx6vmgJuy78Ih9QxFoOy.jpg;15/10/2004;97.0;Every nightmare has a beginning.;Cube Zero;False;5.7
;[{'id': 35, 'name': 'Comedy'}, {'id': 18, 'name': 'Drama'}];439;tt0053779;La dolce vita;Episodic journey of an Italian journalist scouring Rome in search of love.;/mZJ25Th65B2KXM57uIiEzO3Aw81.jpg;05/02/1960;174.0;The world's most talked about movie today!;La Dolce Vita;False;7.9
{'id': 115762, 'name': 'AVP Collection', 'poster_path': '/zrApSsUX9i0qVntcCD0Pp55TdCy.jpg', 'backdrop_path': '/c5ccDw4lcTUnYGdCxc2yEl8PjTk.jpg'};[{'id': 14, 'name': 'Fantasy'}, {'id': 28, 'name': 'Action'}, {'id': 878, 'name': 'Science Fiction'}, {'id': 53, 'name': 'Thriller'}, {'id': 27, 'name': 'Horror'}];440;tt0758730;Aliens vs Predator: Requiem;A sequel to 2004's Alien vs. Predator, the iconic creatures from two of the scariest film franchises in movie history wage their most brutal battle ever - in our own backyard. The small town of Gunnison, Colorado becomes a war zone between two of the deadliest extra-terrestrial life forms - the Alien and the Predator. When a Predator scout ship crash-lands in the hills outside the town, Alien Facehuggers and a hybrid Alien/Predator are released and begin to terrorize the town.;/bpA5nTpqb6qLWYwmyN61dViKrRt.jpg;25/12/2007;94.0;The Last Place On Earth We Want To Be Is In The Middle;Aliens vs Predator: Requiem;False;4.9
;[{'id': 18, 'name': 'Drama'}, {'id': 35, 'name': 'Comedy'}];441;tt0219822;Human Nature;A philosophical burlesque, Human Nature follows the ups and downs of an obsessive scientist, a female naturalist, and the man they discover, born and raised in the wild. As scientist Nathan trains the wild man, Puff, in the ways of the world - starting with table manners - Nathan's lover Lila fights to preserve the man's simian past, which represents a freedom enviable to most.;/2NGy7wfkYkbgFHnDJhYhonqHRrA.jpg;18/05/2001;96.0;In the Interest of Civilization... Conform.;Human Nature;False;6.1
;[{'id': 35, 'name': 'Comedy'}, {'id': 18, 'name': 'Drama'}];442;tt0314524;Populärmusik från Vittula;Two boys grow up together in town of Pajala at 60's united by rock-n-roll music.;/wKqe4jBMhYVQUO64IUeF7Q5h2CX.jpg;24/09/2004;100.0;;Popular Music;False;6.0
;[{'id': 9648, 'name': 'Mystery'}, {'id': 18, 'name': 'Drama'}, {'id': 53, 'name': 'Thriller'}];445;tt0387898;Caché;A married couple is terrorized by a series of videotapes planted on their front porch.;/i1Zl8S4DgM3IDLW5dhZzBnIdCOe.jpg;02/05/2005;117.0;;Caché;False;7.0
;[{'id': 18, 'name': 'Drama'}, {'id': 10749, 'name': 'Romance'}];451;tt0113627;Leaving Las Vegas;Ben Sanderson, an alcoholic Hollywood screenwriter who lost everything because of his drinking, arrives in Las Vegas to drink himself to death. There, he meets and forms an uneasy friendship and non-interference pact with prostitute Sera.;/37qHRJxnSh5YkuaN9FgfNnMl3Tj.jpg;27/10/1995;112.0;I Love You... The Way You Are.;Leaving Las Vegas;False;7.1
{'id': 498, 'name': 'Heart of Gold Collection', 'poster_path': '/cwrmUIVzOuR9FdqKBfERkMHdde0.jpg', 'backdrop_path': '/293UTX2btTkblOL7WZF1Q7veIJm.jpg'};[{'id': 18, 'name': 'Drama'}, {'id': 35, 'name': 'Comedy'}];452;tt0154421;Idioterne;With his first Dogma-95 film director Lars von Trier opens up a completely new film platform. With a mix of home-video and documentary styles the film tells the story of a group of young people who have decided to get to know their “inner-idiots” and thus not only facing and breaking their outer appearance but also their inner.;/myMAaET7kCGSp3vyUcvd8hwTnD6.jpg;28/04/1998;117.0;;The Idiots;False;6.7
;[{'id': 18, 'name': 'Drama'}, {'id': 10749, 'name': 'Romance'}];453;tt0268978;A Beautiful Mind;At Princeton University, John Nash struggles to make a worthwhile contribution to serve as his legacy to the world of mathematics. He finally makes a revolutionary breakthrough that will eventually earn him the Nobel Prize. After graduate school he turns to teaching, becoming romantically involved with his student Alicia. Meanwhile the government asks his help with breaking Soviet codes, which soon gets him involved in a terrifying conspiracy plot. Nash grows more and more paranoid until a discovery that turns his entire world upside down. Now it is only with Alicia's help that he will be able to recover his mental strength and regain his status as the great mathematician we know him as today..;/4SFqHDZ1NvWdysucWbgnYlobdxC.jpg;11/12/2001;135.0;I need to believe that something extra ordinary is possible...;A Beautiful Mind;False;7.7
;[{'id': 18, 'name': 'Drama'}, {'id': 10749, 'name': 'Romance'}];454;tt0117509;Romeo + Juliet;In director Baz Luhrmann's contemporary take on William Shakespeare's classic tragedy, the Montagues and Capulets have moved their ongoing feud to the sweltering suburb of Verona Beach, where Romeo and Juliet fall in love and secretly wed. Though the film is visually modern, the bard's dialogue remains.;/6VsRWzhx9i3FNcggVrNwYLMUdxa.jpg;31/10/1996;120.0;My only love sprung from my only hate.;Romeo + Juliet;False;6.7
;[{'id': 35, 'name': 'Comedy'}, {'id': 18, 'name': 'Drama'}, {'id': 10749, 'name': 'Romance'}];455;tt0286499;Bend It Like Beckham;Jess Bhamra, the daughter of a strict Indian couple in London, is not permitted to play organized soccer, even though she is 18. When Jess is playing for fun one day, her impressive skills are seen by Jules Paxton, who then convinces Jess to play for her semi-pro team. Jess uses elaborate excuses to hide her matches from her family while also dealing with her romantic feelings for her coach, Joe.;/aaLAIPw9vJSVyQLy390TJrntEwF.jpg;11/04/2002;112.0;Sometimes, to follow your dreams... you've got to bend the rules!;Bend It Like Beckham;False;6.2
;[{'id': 35, 'name': 'Comedy'}];460;tt0416331;Alles auf Zucker!;Germany director Dani Levy filmed this comedy about Jewish life in today’s Germany along side the familiar east-west conflict. With it great success this film is a joyful comedy of humor and knowledge.;/vSkpSVJwp2R5DDcGNDmgV83uLO8.jpg;06/01/2005;136.0;;Go for Zucker;False;6.6
;[{'id': 18, 'name': 'Drama'}];462;tt0195685;Erin Brockovich;A twice-divorced mother of three who sees an injustice, takes on the bad guy and wins -- with a little help from her push-up bra. Erin goes to work for an attorney and comes across medical records describing illnesses clustered in one nearby town. She starts investigating and soon exposes a monumental cover-up.;/if90sXZkI4aaxdlhxKejpniT9ff.jpg;17/03/2000;131.0;She brought a small town to its feet and a huge corporation to its knees.;Erin Brockovich;False;7.1
;[{'id': 10749, 'name': 'Romance'}, {'id': 18, 'name': 'Drama'}, {'id': 35, 'name': 'Comedy'}, {'id': 10402, 'name': 'Music'}];464;tt0382330;Så som i himmelen;A musical romantic tragedy about a famous composer who moves back to his small hometown after having had heart troubles. His search for a simple everyday life leads him into teaching the local church choir which is not easily accepted by the town yet the choir builds a great love for their teacher.;/86c6dJecxlptDUtfkAHcyxeWkNQ.jpg;03/09/2004;132.0;;As It Is in Heaven;False;7.0
;[{'id': 10749, 'name': 'Romance'}, {'id': 18, 'name': 'Drama'}];465;tt0094596;36 Fillette;Lili, a pouty and voluptuous 14-year-old, is caravan camping with her family in Biarritz. She's self-aware and holds her own in a café conversation with a concert pianist she meets, but she has a wild streak and she's testing her powers over men, finding that she doesn't always control her moods or actions, and she's impatient with being a virgin. She sets off with her brother to a disco, latching onto an aging playboy who is himself hot and cold to her. She is ambivalent about losing her virginity that night, willing the next, and determined by the third. The playboy's mix of depression and misogyny ends their unconsummated affair, so Lili has to hunt elsewhere.;/9nOr9of8cIOT90Rmm15HG6cjvsF.jpg;03/03/1988;88.0;;Junior Size 36;False;5.3
;[{'id': 9648, 'name': 'Mystery'}];466;tt0067309;Klute;This acclaimed thriller stars Jane Fonda as Bree Daniel, a New York City call girl who becomes enmeshed in an investigation into the disappearance of a business executive. Detective John Klute is hired to follow Daniel, and eventually begins a romance with her, but it appears that he hasn't been the only person on her trail. When it becomes clear that Daniel is being targeted, it's up to her and Klute to figure out who is after her before it's too late.;/na0G9mmPKDWBhmLc5Rh2Eiwux6N.jpg;21/06/1971;114.0;You'd never take her for a call girl. You'd never take him for a cop.;Klute;False;6.5
;[{'id': 80, 'name': 'Crime'}, {'id': 18, 'name': 'Drama'}, {'id': 27, 'name': 'Horror'}, {'id': 53, 'name': 'Thriller'}];467;tt0242527;The Hole;Four teenagers at a British private school secretly uncover and explore the depths of a sealed underground hole created decades ago as a possible bomb shelter.;/uKq5U7NfEBXn85AvpXtHhp0p2BG.jpg;20/04/2001;102.0;Once you get in, you can't get out.;The Hole;False;6.4
;[{'id': 18, 'name': 'Drama'}, {'id': 10749, 'name': 'Romance'}];468;tt0102494;My Own Private Idaho;"In this loose adaptation of Shakespeare's ""Henry IV,"" Mike Waters (River Phoenix) is a gay hustler afflicted with narcolepsy. Scott Favor (Keanu Reeves) is the rebellious son of a mayor. Together, the two travel from Portland, Oregon to Idaho and finally to the coast of Italy in a quest to find Mike's estranged mother. Along the way they turn tricks for money and drugs, eventually attracting the attention of a wealthy benefactor and sexual deviant.";/2AzIv2b6mI2Ye4uJUTdi4wjIvLb.jpg;17/10/1991;104.0;It's not where you go, it's how you get there.;My Own Private Idaho;False;7.1
;[{'id': 35, 'name': 'Comedy'}, {'id': 18, 'name': 'Drama'}];469;tt0088184;Stranger Than Paradise;Rootless Hungarian émigré Willie, his pal Eddie, and visiting sixteen-year-old cousin Eva always manage to make the least of any situation, whether aimlessly traversing the drab interiors and environs of New York City, Cleveland, or an anonymous Florida suburb.;/Ett7TAy9y5R0p08REDgErVmLPf.jpg;01/10/1984;89.0;;Stranger Than Paradise;False;7.4
;[{'id': 18, 'name': 'Drama'}, {'id': 80, 'name': 'Crime'}, {'id': 53, 'name': 'Thriller'}];470;tt0315733;21 Grams;This is the story of three gentle persons: Paul Rivers an ailing mathematician lovelessly married to an English émigré, Christina Peck, an upper-middle-class suburban housewife, happily married and mother of two little girls, and Jack Jordan, an ex-convict who has found in his Christian faith the strength to raise a family. They will be brought together by a terrible accident that will change their lives. By the final frame, none of them will be the same as they will learn harsh truths about love, faith, courage, desire and guilt, and how chance can change our worlds irretrievably, forever.;/Aps7GzrYiJZKHNT524Rsg4jaXej.jpg;06/09/2003;124.0;How much does life weigh?;21 Grams;False;7.2
;[{'id': 9648, 'name': 'Mystery'}, {'id': 18, 'name': 'Drama'}, {'id': 53, 'name': 'Thriller'}];473;tt0138704;Pi;The debut film from Darren Aronofsky in which a mathematical genius Maximilian Cohen discovers a link in the connection between numbers and reality and thus believes he can predict the future.;/d4pDorUHjIVFiVGiJar6sF2r8TQ.jpg;10/07/1998;84.0;There will be no order, only chaos;Pi;False;7.1
;[{'id': 80, 'name': 'Crime'}, {'id': 18, 'name': 'Drama'}];475;tt0061418;Bonnie and Clyde;Bonnie and Clyde is based on the true stories of the gangster pair Bonnie Parker and Clyde Barrow who in the 1930s began robbing banks in U.S. cities until they were eventually killed. The film is a major landmark in the aesthetic movement known as the New Hollywood.;/3tX1FJiXnk515NtRuF18PFC4CVy.jpg;18/07/1967;111.0;They’re young… they’re in love… and they kill people.;Bonnie and Clyde;False;7.6
;[{'id': 80, 'name': 'Crime'}, {'id': 18, 'name': 'Drama'}];476;tt0097240;Drugstore Cowboy;Bob and his friends Dianne, Rick and Nadine have been drug addicts for years and live from one high to the next. Gus Van Sant attempts to show an intimate look into the lives of heroin addicts with his film Drugstore Cowboy.;/zS5kDGjVGHHryzuG9HjazYLXSTO.jpg;09/09/1989;100.0;;Drugstore Cowboy;False;7.0
{'id': 495, 'name': 'Shaft Collection', 'poster_path': '/z6UFfaPSYIEMZGxiNGuy881hcsH.jpg', 'backdrop_path': '/muZrPdBs937VAx03Giw66x1XGus.jpg'};[{'id': 28, 'name': 'Action'}, {'id': 12, 'name': 'Adventure'}, {'id': 80, 'name': 'Crime'}, {'id': 53, 'name': 'Thriller'}];479;tt0162650;Shaft;New York police detective John Shaft arrests Walter Wade Jr. for a racially motivated slaying. But the only eyewitness disappears, and Wade jumps bail for Switzerland. Two years later Wade returns to face trial, confident his money and influence will get him acquitted -- especially since he's paid a drug kingpin to kill the witness.;/bqlpFp96uWu2VDpsm4MVvLXdumh.jpg;15/06/2000;99.0;Still the man, any questions?;Shaft;False;5.5
;[{'id': 35, 'name': 'Comedy'}, {'id': 18, 'name': 'Drama'}, {'id': 10749, 'name': 'Romance'}];480;tt0265343;Monsoon Wedding;From an exciting Indian wedding comes a relationship from two different times not only showing the modern but also the traditional. Different characters and stories interact with each other in director Mira Nair film where she used an Indian-American production to illustrate these themes modern day Indians are very familiar with.;/2LysDwqhK0GlGtQqjPCiDeiBoqU.jpg;30/08/2001;114.0;A stressed father, a bride-to-be with a secret, a smitten event planner, and relatives from around the world create much ado about the preparations for an arranged marriage in India.;Monsoon Wedding;False;6.8
{'id': 495, 'name': 'Shaft Collection', 'poster_path': '/z6UFfaPSYIEMZGxiNGuy881hcsH.jpg', 'backdrop_path': '/muZrPdBs937VAx03Giw66x1XGus.jpg'};[{'id': 12, 'name': 'Adventure'}, {'id': 28, 'name': 'Action'}, {'id': 53, 'name': 'Thriller'}, {'id': 80, 'name': 'Crime'}];482;tt0067741;Shaft;Cool black private eye John Shaft is hired by a crime lord to find and retrieve his kidnapped daughter.;/ez5aGeyOvG2F1QzKYHzkMmkDuM2.jpg;02/07/1971;100.0;The mob wanted Harlem back. They got shaft...up to here.;Shaft;False;6.5
;[{'id': 35, 'name': 'Comedy'}, {'id': 80, 'name': 'Crime'}, {'id': 53, 'name': 'Thriller'}];483;tt0100935;Wild at Heart;Young lovers Sailor and Lula run from the variety of weirdos that Lula's mom has hired to kill Sailor.;/d4fbQjSSBd4FPyAROln1skafChr.jpg;01/05/1990;124.0;A wild crazy love story.;Wild at Heart;False;7.0
;[{'id': 12, 'name': 'Adventure'}, {'id': 10752, 'name': 'War'}, {'id': 10749, 'name': 'Romance'}];488;tt0043265;The African Queen;At the start of the first World War, in the middle of Africa’s nowhere, a gin soaked riverboat captain is persuaded by a strong-willed missionary to go down river and face-off a German warship.;/mw1O0JxtDgXt2FHZnUn8w0wrjF1.jpg;03/12/1951;105.0;The greatest adventure a man ever lived...with a woman!;The African Queen;False;7.4
;[{'id': 18, 'name': 'Drama'}];489;tt0119217;Good Will Hunting;Will Hunting has a genius-level IQ but chooses to work as a janitor at MIT. When he solves a difficult graduate-level math problem, his talents are discovered by Professor Gerald Lambeau, who decides to help the misguided youth reach his potential. When Will is arrested for attacking a police officer, Professor Lambeau makes a deal to get leniency for him if he will get treatment from therapist Sean Maguire.;/jq8LjngZ7XZEQge5JFTdOGMrHyZ.jpg;05/12/1997;126.0;Some people can never believe in themselves, until someone believes in them.;Good Will Hunting;False;7.9
;[{'id': 14, 'name': 'Fantasy'}, {'id': 18, 'name': 'Drama'}];490;tt0050976;Det sjunde inseglet;When disillusioned Swedish knight Antonius Block returns home from the Crusades to find his country in the grips of the Black Death, he challenges Death to a chess match for his life. Tormented by the belief that God does not exist, Block sets off on a journey, meeting up with traveling players Jof and his wife, Mia, and becoming determined to evade Death long enough to commit one redemptive act while he still lives.;/iJXSumDrz64AvmFZaHHNBGDO1ex.jpg;16/02/1957;96.0;;The Seventh Seal;False;7.9
;[{'id': 14, 'name': 'Fantasy'}, {'id': 18, 'name': 'Drama'}, {'id': 35, 'name': 'Comedy'}];492;tt0120601;Being John Malkovich;Spike Jonze’s debut feature film is a love story mix of comedy and fantasy. The story is about an unsuccessful puppeteer named Craig, who one day at work finds a portal into the head of actor John Malkovich. The portal soon becomes a passion for anybody who enters it’s mad and controlling world of overtaking another human body.;/gLhl4MBEC6yHTInwV7TxV1D3FLp.jpg;30/09/1999;112.0;Ever wanted to be someone else? Now you can.;Being John Malkovich;False;7.3
{'id': 495, 'name': 'Shaft Collection', 'poster_path': '/z6UFfaPSYIEMZGxiNGuy881hcsH.jpg', 'backdrop_path': '/muZrPdBs937VAx03Giw66x1XGus.jpg'};[{'id': 28, 'name': 'Action'}, {'id': 12, 'name': 'Adventure'}, {'id': 80, 'name': 'Crime'}, {'id': 9648, 'name': 'Mystery'}];493;tt0069257;Shaft's Big Score!;John Shaft is back as the lady-loved black detective cop on the search for the murderer of a client.;/jioGhMgP8d7eu1G7YT7xeyLOJuc.jpg;08/06/1972;104.0;Last time he was nice. This time he's ice!;Shaft's Big Score!;False;6.1
